{"$schema":"https://json-schema.org/draft/2020-12/schema","$id":"paper-record.schema.json","title":"Paper Record","type":"object","required":["schema_version","paper","contribution_type","claims","methods_assumptions","experimental_conditions","artifacts","limitations","real_time_applicability","verdict","confidence"],"properties":{"schema_version":{"type":"string","minLength":1,"pattern":"\\S"},"paper":{"type":"object","required":["title","authors","year"],"properties":{"title":{"type":"string","minLength":1,"pattern":"\\S"},"authors":{"type":"array","minItems":1,"items":{"type":"string","minLength":1,"pattern":"\\S"}},"year":{"type":"integer","minimum":1},"doi":{"type":"string","minLength":1,"pattern":"\\S"},"url":{"type":"string","minLength":1,"pattern":"\\S"},"arxiv":{"type":"string","minLength":1,"pattern":"\\S"},"primary_link":{"type":"string","minLength":1,"pattern":"\\S"}},"anyOf":[{"required":["doi"]},{"required":["url"]},{"required":["arxiv"]},{"required":["primary_link"]}],"additionalProperties":false},"contribution_type":{"type":"string","minLength":1,"pattern":"\\S"},"claims":{"type":"array","minItems":1,"items":{"type":"object","required":["claim","evidence_anchors"],"properties":{"claim":{"type":"string","minLength":1,"pattern":"\\S"},"evidence_anchors":{"type":"array","minItems":1,"items":{"type":"string","minLength":1,"pattern":"\\S"}}},"additionalProperties":false}},"methods_assumptions":{"type":"array","minItems":1,"items":{"type":"string","minLength":1,"pattern":"\\S"}},"experimental_conditions":{"type":"array","minItems":1,"items":{"type":"string","minLength":1,"pattern":"\\S"}},"artifacts":{"type":"object","minProperties":1},"limitations":{"type":"array","minItems":1,"items":{"type":"string","minLength":1,"pattern":"\\S"}},"real_time_applicability":{"type":"string","minLength":1,"pattern":"\\S"},"verdict":{"enum":["supported","mixed","unsupported","insufficient-evidence"]},"confidence":{"type":"number","minimum":0,"maximum":1}},"additionalProperties":false}
