{"schema_version":"1","paper":{"title":"Stable Contacts","authors":["A. Researcher"],"year":2025,"doi":"10.1000/example"},"contribution_type":"method","claims":[{"claim":"The method reduces jitter.","evidence_anchors":["Figure 3"]}],"methods_assumptions":["Fixed step"],"experimental_conditions":["Stack scene"],"artifacts":{"code":"https://example.test/code"},"limitations":["GPU only"],"real_time_applicability":"60 FPS on target hardware","verdict":"supported","confidence":0.9}
